16:30:43.389602 ARP, Request who-has 10.244.1.1 tell 10.244.1.2, length 28
16:30:43.390373 ARP, Reply 10.244.1.1 is-at 4e:e8:53:6a:6b:55 (oui Unknown), length 28
16:31:08.057492 IP 10.244.1.2.40164 > 10.96.0.1.https: Flags [P.], seq 1351065026:1351065065, ack 3154770579, win 17346, options [nop,nop,TS val 1357885408 ecr 541447871], length 39
16:31:08.059202 IP 10.96.0.1.https > 10.244.1.2.40164: Flags [P.], seq 1:40, ack 39, win 635, options [nop,nop,TS val 541477878 ecr 1357885408], length 39
16:31:08.059277 IP 10.244.1.2.40164 > 10.96.0.1.https: Flags [.], ack 40, win 17346, options [nop,nop,TS val 1357885410 ecr 541477878], length 0
16:31:13.092438 ARP, Request who-has 10.244.1.2 tell 10.244.1.1, length 28
16:31:13.092448 ARP, Reply 10.244.1.2 is-at ce:b5:c0:6e:1f:0c (oui Unknown), length 28
16:31:16.735455 IP 10.96.0.1.https > 10.244.1.2.40164: Flags [P.], seq 40:185, ack 39, win 635, options [nop,nop,TS val 541486555 ecr 1357885410], length 145
16:31:16.735497 IP 10.244.1.2.40164 > 10.96.0.1.https: Flags [.], ack 185, win 17346, options [nop,nop,TS val 1357894086 ecr 541486555], length 0
16:31:46.737678 IP 10.244.1.2.40164 > 10.96.0.1.https: Flags [P.], seq 39:78, ack 185, win 17346, options [nop,nop,TS val 1357924088 ecr 541486555], length 39
16:31:46.738976 IP 10.96.0.1.https > 10.244.1.2.40164: Flags [P.], seq 185:224, ack 78, win 635, options [nop,nop,TS val 541516558 ecr 1357924088], length 39
16:31:46.739006 IP 10.244.1.2.40164 > 10.96.0.1.https: Flags [.], ack 224, win 17346, options [nop,nop,TS val 1357924089 ecr 541516558], length 0
16:32:16.743348 IP 10.244.1.2.40164 > 10.96.0.1.https: Flags [P.], seq 78:117, ack 224, win 17346, options [nop,nop,TS val 1357954094 ecr 541516558], length 39
16:32:16.744599 IP 10.96.0.1.https > 10.244.1.2.40164: Flags [P.], seq 224:263, ack 117, win 635, options [nop,nop,TS val 541546564 ecr 1357954094], length 39
16:32:16.744609 IP 10.244.1.2.40164 > 10.96.0.1.https: Flags [.], ack 263, win 17346, options [nop,nop,TS val 1357954095 ecr 541546564], length 0
16:32:17.206903 IP 10.96.0.1.https > 10.244.1.2.40164: Flags [P.], seq 263:408, ack 117, win 635, options [nop,nop,TS val 541547026 ecr 1357954095], length 145
16:32:17.206954 IP 10.244.1.2.40164 > 10.96.0.1.https: Flags [.], ack 408, win 17346, options [nop,nop,TS val 1357954557 ecr 541547026], length 0
16:32:47.212212 IP 10.244.1.2.40164 > 10.96.0.1.https: Flags [P.], seq 117:156, ack 408, win 17346, options [nop,nop,TS val 1357984563 ecr 541547026], length 39
16:32:47.213282 IP 10.96.0.1.https > 10.244.1.2.40164: Flags [P.], seq 408:447, ack 156, win 635, options [nop,nop,TS val 541577032 ecr 1357984563], length 39
16:32:47.213310 IP 10.244.1.2.40164 > 10.96.0.1.https: Flags [.], ack 447, win 17346, options [nop,nop,TS val 1357984564 ecr 541577032], length 0
16:33:17.227539 IP 10.244.1.2.40164 > 10.96.0.1.https: Flags [P.], seq 156:195, ack 447, win 17346, options [nop,nop,TS val 1358014578 ecr 541577032], length 39
16:33:17.228285 IP 10.96.0.1.https > 10.244.1.2.40164: Flags [P.], seq 447:486, ack 195, win 635, options [nop,nop,TS val 541607048 ecr 1358014578], length 39
16:33:17.228294 IP 10.244.1.2.40164 > 10.96.0.1.https: Flags [.], ack 486, win 17346, options [nop,nop,TS val 1358014579 ecr 541607048], length 0
16:33:17.516889 IP 10.96.0.1.https > 10.244.1.2.40164: Flags [P.], seq 486:631, ack 195, win 635, options [nop,nop,TS val 541607336 ecr 1358014579], length 145
16:33:17.516914 IP 10.244.1.2.40164 > 10.96.0.1.https: Flags [.], ack 631, win 17346, options [nop,nop,TS val 1358014868 ecr 541607336], length 0
16:33:47.518624 IP 10.244.1.2.40164 > 10.96.0.1.https: Flags [P.], seq 195:234, ack 631, win 17346, options [nop,nop,TS val 1358044869 ecr 541607336], length 39
16:33:47.520407 IP 10.96.0.1.https > 10.244.1.2.40164: Flags [P.], seq 631:670, ack 234, win 635, options [nop,nop,TS val 541637339 ecr 1358044869], length 39
16:33:47.520426 IP 10.244.1.2.40164 > 10.96.0.1.https: Flags [.], ack 670, win 17346, options [nop,nop,TS val 1358044871 ecr 541637339], length 0
16:34:17.163724 IP 10.96.0.1.https > 10.244.1.2.40164: Flags [P.], seq 670:815, ack 234, win 635, options [nop,nop,TS val 541666983 ecr 1358044871], length 145
16:34:17.163760 IP 10.244.1.2.40164 > 10.96.0.1.https: Flags [.], ack 815, win 17346, options [nop,nop,TS val 1358074515 ecr 541666983], length 0
16:34:47.179563 IP 10.244.1.2.40164 > 10.96.0.1.https: Flags [P.], seq 234:273, ack 815, win 17346, options [nop,nop,TS val 1358104530 ecr 541666983], length 39
16:34:47.180729 IP 10.96.0.1.https > 10.244.1.2.40164: Flags [P.], seq 815:854, ack 273, win 635, options [nop,nop,TS val 541697000 ecr 1358104530], length 39
16:34:47.180740 IP 10.244.1.2.40164 > 10.96.0.1.https: Flags [.], ack 854, win 17346, options [nop,nop,TS val 1358104531 ecr 541697000], length 0
16:34:52.222206 ARP, Request who-has 10.244.1.1 tell 10.244.1.2, length 28
16:34:52.222861 ARP, Reply 10.244.1.1 is-at 4e:e8:53:6a:6b:55 (oui Unknown), length 28
